{
  "dataset_name": "so100_pickplace",
  "profile": "strict",
  "overall_pass": true,
  "exit_code": 0,
  "timestamp": "2026-04-27T05:32:18.396231+00:00",
  "dataset_overview": {
    "name": "so100_pickplace",
    "total_episodes": 50,
    "total_frames": 50,
    "storage_bytes": 470027245,
    "storage_human": "448.3 MB",
    "has_multiview": false,
    "cameras": []
  },
  "metrics": {
    "fps_consistency": {
      "value": 0.001,
      "threshold": 5.0,
      "passed": true,
      "details": {
        "worst_episode_ratio": 0.0013902675709687173,
        "fps_mean_avg": 30.0,
        "fps_std_avg": 0.0,
        "episodes_checked": 50,
        "data_source": "data"
      }
    },
    "missing_frames": {
      "value": 0.0,
      "threshold": 1.0,
      "passed": true,
      "details": {
        "total_missing": 0,
        "total_expected": 19631,
        "episodes_checked": 50,
        "data_source": "data"
      }
    },
    "multiview_sync": {
      "value": 0.0,
      "threshold": 50.0,
      "passed": true,
      "details": {
        "note": "single view dataset, check skipped",
        "num_views": 1,
        "keys": []
      }
    },
    "task_label": {
      "value": 0.0,
      "threshold": 0.0,
      "passed": true,
      "details": {
        "total_episodes": 50,
        "missing_count": 0,
        "missing_episodes": [],
        "label_col": "tasks",
        "data_source": "episodes_parquet"
      }
    },
    "anomaly_frames": {
      "value": 0.0,
      "threshold": 0.5,
      "passed": true,
      "details": {
        "note": "anomaly detection not yet implemented"
      }
    }
  },
  "top_anomalies": [],
  "repair_suggestions": [
    "本次检查全部通过，数据可直接进入 curated 阶段。"
  ],
  "vla_training_impact": {
    "can_proceed": true,
    "risk_level": "low",
    "reason": "所有质量指标达标，数据可直接进入 training 阶段。"
  }
}